paperId,externalIds,publicationVenue,title,year,referenceCount,citationCount,openAccessPdf,journal,citationStyles,authors,abstract
961b57baa18e42e1087156fac26897ccc9760720,"{'DOI': '10.1093/ageing/afad206', 'CorpusId': 265280994, 'PubMed': '37979182'}","{'id': '418f9478-b986-4e84-a38c-7ebba5d688eb', 'name': 'Age and Ageing', 'type': 'journal', 'alternate_names': ['Age Ageing'], 'issn': '0002-0729', 'url': 'http://ageing.oxfordjournals.org/'}",We should be screening for benign paroxysmal positional vertigo (BPPV) in all older adults at risk of falling: a commentary on the World Falls Guidelines.,2023,17,17,"{'url': 'http://hdl.handle.net/10044/1/107052', 'status': 'GREEN', 'license': None, 'disclaimer': 'Notice: Paper or abstract available at https://api.unpaywall.org/v2/10.1093/ageing/afad206?email=<INSERT_YOUR_EMAIL> or https://doi.org/10.1093/ageing/afad206, which is subject to the license by the author or copyright owner provided with this content. Please go to the source to verify the license and copyright information for your use.'}","{'name': 'Age and ageing', 'volume': '52 11'}","{'bibtex': '@Article{Li2023WeSB,\n author = {Yuxiao Li and Rebecca M. Smith and Susan L. Whitney and B. Seemungal and T. Ellmers},\n booktitle = {Age and Ageing},\n journal = {Age and ageing},\n title = {We should be screening for benign paroxysmal positional vertigo (BPPV) in all older adults at risk of falling: a commentary on the World Falls Guidelines.},\n volume = {52 11},\n year = {2023}\n}\n'}","[{'authorId': '2267310741', 'name': 'Yuxiao Li'}, {'authorId': '1944575898', 'name': 'Rebecca M. Smith'}, {'authorId': '2262392892', 'name': 'Susan L. Whitney'}, {'authorId': '2267238339', 'name': 'B. Seemungal'}, {'authorId': '32231306', 'name': 'T. Ellmers'}]","Benign paroxysmal positional vertigo (BPPV) is amongst the commonest causes of dizziness and falls in older adults. Diagnosing and treating BPPV can reduce falls, and thereby reduce fall-related morbidity and mortality. Recent World Falls Guidelines recommend formal assessment for BPPV in older adults at risk of falling, but only if they report vertigo. However, this recommendation ignores the data that (i) many older adults with BPPV experience dizziness as vague unsteadiness (rather than vertigo), and (ii) others may experience no symptoms of dizziness at all. BPPV without vertigo is due to an impaired vestibular perception of self-motion, termed 'vestibular agnosia'. Vestibular agnosia is found in ageing, neurodegeneration and traumatic brain injury, and results in dramatically increased missed BPPV diagnoses. Patients with BPPV without vertigo are typically the most vulnerable for negative outcomes associated with this disorder. We thus recommend simplifying the World Falls Guidelines: all older adults (>60 years) with objective or subjective balance problems, irrespective of symptomatic complaint, should have positional testing to examine for BPPV."
988cc33e9086ee01fb0601a748bec78b5ae5b085,"{'PubMedCentral': '10693044', 'DOI': '10.1186/s12875-023-02217-z', 'CorpusId': 265517768, 'PubMed': '38042776'}","{'id': '62d79695-748e-4774-afe3-af4db081f9d8', 'name': 'BMC Primary Care', 'type': 'journal', 'alternate_names': ['BMC Prim Care'], 'issn': '2731-4553', 'url': 'https://bmcprimcare.biomedcentral.com/'}",Epley manoeuvre’s efficacy for benign paroxysmal positional vertigo (BPPV) in primary-care and subspecialty settings: a systematic review and meta-analysis,2023,51,11,"{'url': 'https://bmcprimcare.biomedcentral.com/counter/pdf/10.1186/s12875-023-02217-z', 'status': 'GOLD', 'license': 'CCBY', 'disclaimer': 'Notice: Paper or abstract available at https://pmc.ncbi.nlm.nih.gov/articles/PMC10693044, which is subject to the license by the author or copyright owner provided with this content. Please go to the source to verify the license and copyright information for your use.'}","{'name': 'BMC Primary Care', 'volume': '24'}","{'bibtex': '@Article{Saishoji2023EpleyME,\n author = {Yusuke Saishoji and N. Yamamoto and Takashi Fujiwara and Hideki Mori and S. Taito},\n booktitle = {BMC Primary Care},\n journal = {BMC Primary Care},\n title = {Epley manoeuvre’s efficacy for benign paroxysmal positional vertigo (BPPV) in primary-care and subspecialty settings: a systematic review and meta-analysis},\n volume = {24},\n year = {2023}\n}\n'}","[{'authorId': '1471924013', 'name': 'Yusuke Saishoji'}, {'authorId': '2164910491', 'name': 'N. Yamamoto'}, {'authorId': '2268878459', 'name': 'Takashi Fujiwara'}, {'authorId': '2268880832', 'name': 'Hideki Mori'}, {'authorId': '5160144', 'name': 'S. Taito'}]","Background Although previous studies have reported general inexperience with the Epley manoeuvre (EM) among general physicians, no report has evaluated the effect of EM on benign paroxysmal positional vertigo (BPPV) in primary care by using point estimates or certainty of evidence. We conducted this systematic review and meta-analysis and clarified the efficacy of EM for BPPV, regardless of primary-care and subspecialty settings. Methods Systematic review and meta-analysis of randomised sham-controlled trials of EM for the treatment of posterior canal BPPV in primary-care and subspecialty settings. A primary-care setting was defined as a practice setting by general practitioners, primary-care doctors, or family doctors. A systematic search was conducted in January 2022 across databases, including Cochrane Central Resister of Controlled Trial, MEDLINE, Embase, Cumulative Index of Nursing and Allied Health Literature, World Health Organization International Clinical Trials Registry Platform, and ClinicalTrials.gov. Primary outcomes were the disappearance of subjective symptoms (vertigo), negative findings (Dix–Hallpike test), and all adverse events. We evaluated the certainty of evidence using the Grading of Recommendations, Assessment, Development and Evaluation approach. Results Twenty-seven randomised controlled trials were identified. In primary-care settings, EM reduced the subjective symptoms [risk ratio (RR), 3.14; 95% confidence interval (CI), 1.96–5.02]; however, there was no applicable article for all adverse events. In the subspeciality setting, EM reduced the subjective symptoms (RR, 2.42; 95% CI, 1.64–3.56), resulting in an increase in negative findings (RR, 1.81; 95% CI, 1.40–2.34). The evidence exhibited uncertainty about the effect of EM on negative findings in primary-care settings and all adverse events in subspecialty settings. Conclusions Regardless of primary-care and subspecialty settings, EM for BPPV was effective. This study has shown the significance of performing EM for BPPV in primary-care settings. EM for BPPV in a primary-care setting may aid in preventing referrals to higher tertiary care facilities and hospitalisation for follow-up. Trial registration The study was registered in protocols.io (PROTOCOL INTEGER ID: 51,464) on July 11, 2021."
d0bec38504b0bc16d56a7f4ee7662d742b0ebef5,"{'DOI': '10.1186/s43163-023-00456-6', 'CorpusId': 259078153}","{'id': 'eada7048-a9d9-4e80-b25a-9674b6af51c4', 'name': 'The Egyptian Journal of Otolaryngology', 'type': 'journal', 'alternate_names': ['Egypt J Otolaryngol'], 'issn': '1012-5574', 'url': 'http://www.ejo.eg.net/backissues.asp', 'alternate_urls': ['https://ejo.springeropen.com']}",Epidemiology of benign paroxysomal positional vertigo (BPPV) and risk factors for secondary BPPV: a population-based study,2023,10,9,"{'url': 'https://ejo.springeropen.com/counter/pdf/10.1186/s43163-023-00456-6', 'status': 'GOLD', 'license': 'CCBY', 'disclaimer': 'Notice: Paper or abstract available at https://api.unpaywall.org/v2/10.1186/s43163-023-00456-6?email=<INSERT_YOUR_EMAIL> or https://doi.org/10.1186/s43163-023-00456-6, which is subject to the license by the author or copyright owner provided with this content. Please go to the source to verify the license and copyright information for your use.'}","{'name': 'The Egyptian Journal of Otolaryngology', 'volume': '39'}","{'bibtex': '@Article{Ghosh2023EpidemiologyOB,\n author = {Anirban Ghosh and Srinivas Dorasala},\n booktitle = {The Egyptian Journal of Otolaryngology},\n journal = {The Egyptian Journal of Otolaryngology},\n title = {Epidemiology of benign paroxysomal positional vertigo (BPPV) and risk factors for secondary BPPV: a population-based study},\n volume = {39},\n year = {2023}\n}\n'}","[{'authorId': '47581727', 'name': 'Anirban Ghosh'}, {'authorId': '6833929', 'name': 'Srinivas Dorasala'}]","BPPV (benign paroxysmal positional vertigo) is a disorder that causes sudden, spinning sensation for few seconds with specific head movements. Of all disorders of inner ear that causes dizziness, BPPP is the most common one. To understand this disorder, we conducted a retrospective study at a tertiary care ENT hospital in Eastern India. 1. To know the incidence of BPPV among all vertigo patients. 2. To know the age-sex distribution of BPPV. 3. To identify secondary causes of BPPV and their prevalence. 4. To know the incidence of different canal BPPVs. 5. To ascertain the treatment outcome of different particle repositioning maneuvers in BPPV. Total 575 patients presented to the vertigo clinic from 15 September 2018 to 21 March 2022. Out of them 151 patients (26.6%) were diagnosed with BPPV by proper history taking, clinical examination including provocative tests. They were treated with appropriate particle repositioning maneuvers (PRM). Patients were followed for mean 6 months and results were analyzed. Of all vertigo patients, BPPV constitutes 26.6% of cases, making it most common cause of peripheral vertigo. It commonly affects 40–60 years of age group with equal sex predilection. Eighty-three percent of cases were idiopathic, secondary causes include vestibular migraine, Meniere’s disease, labyrinthitis, and orthostatic hypotension. Posterior canal was most commonly affected (74%), followed by lateral and anterior canal. Particle repositioning maneuver (PRM) cures 96% of all BPPV patients (75% needs only one PRM, 15% requires the second one) with overall success rate of 96% after 6 months of follow-up. BPPV is the most common cause of peripheral vertigo. One has to understand the anatomy, physiology and pathophysiology of vestibular system to provide better patient care in these patients. Particle repositioning maneuver (PRM) is the treatment for BPPV."
faa49e320dc10f9ec5c998dc59317f4bd040aa88,"{'DOI': '10.1016/j.jns.2022.120158', 'CorpusId': 246054873, 'PubMed': '35091385'}","{'id': '952637fa-2c01-486e-ab08-36253136c67e', 'name': 'Journal of Neurological Sciences', 'type': 'journal', 'alternate_names': ['Journal of Neurological Sciences-turkish', 'J Neurol Sci', 'Journal of the Neurological Sciences'], 'issn': '1302-1664', 'alternate_issns': ['0022-510X', '1300-1817'], 'url': 'http://www.elsevier.com/wps/find/journaldescription.cws_home/506078/description', 'alternate_urls': ['http://www.sciencedirect.com/science/journal/0022510X']}",Minimum Stimulus Strategy: A step-by-step diagnostic approach to BPPV.,2022,74,17,"{'url': '', 'status': None, 'license': None, 'disclaimer': 'Notice: Paper or abstract available at https://api.unpaywall.org/v2/10.1016/j.jns.2022.120158?email=<INSERT_YOUR_EMAIL> or https://doi.org/10.1016/j.jns.2022.120158, which is subject to the license by the author or copyright owner provided with this content. Please go to the source to verify the license and copyright information for your use.'}","{'name': 'Journal of the neurological sciences', 'pages': '\n          120158\n        ', 'volume': '434'}","{'bibtex': '@Article{Libonati2022MinimumSS,\n author = {G. Libonati and S. Martellucci and Andrea Castellucci and P. Malara},\n booktitle = {Journal of Neurological Sciences},\n journal = {Journal of the neurological sciences},\n pages = {\n          120158\n        },\n title = {Minimum Stimulus Strategy: A step-by-step diagnostic approach to BPPV.},\n volume = {434},\n year = {2022}\n}\n'}","[{'authorId': '46314038', 'name': 'G. Libonati'}, {'authorId': '5940038', 'name': 'S. Martellucci'}, {'authorId': '144284214', 'name': 'Andrea Castellucci'}, {'authorId': '66765249', 'name': 'P. Malara'}]","Benign Paroxysmal Positional Vertigo (BPPV) is among the most common vestibular disorders, characterized by brief vertigo spells triggered by head position changes with abrupt onset and rapid decrease. BPPV is ascribed to otoconial matter dislodged from utricular macula and attached to the cupula of the affected semicircular canal (cupulolithiasis) or free-floating within its lumen (canalolithiasis). According to the vestibulo-ocular reflex pathophysiology, each cupular deflection, either exciting or inhibiting the corresponding ampullary afferents, generates the contraction of specific extraocular muscles couples leading to pathognomonic nystagmus. The Upright BPPV Protocol (UBP) is a diagnostic approach to BPPV conducted in the sitting position slowly bending the patient's head along the spatial axes, aiming to move canaliths by gravity within the involved semicircular canal, under continuous nystagmus monitoring by video-Frenzel goggles. UBP starts with the evaluation of pseudo-spontaneous nystagmus in the primary gaze position and continues with the upright Head Pitch Test (uHPT) by forward and backward head bendings along the pitch plane. The uHPT can indicate whether horizontal or vertical semicircular canal is involved. If horizontal canal is suspected, the upright Head Roll Test (uHRT) usually provides the diagnosis of the involved side and arm by tilting the patient's head rightward and leftward along the roll plane. Conversely, canalolithiasis involving the posterior semicircular canal can be diagnosed with the uHPT alone. Nevertheless, if necessary, the diagnostic sensitivity can be increased by head movements along the right anterior - left posterior (RALP) and left anterior - right posterior (LARP) canal planes (uRALP/uLARP test). Following the UBP, most BPPV form can be diagnosed in upright position, allowing clinicians to proceed immediately with proper physical treatment and avoiding unpleasant maneuvers to patients."
1496424938799afa131a4656bb0f1d3ee533d235,"{'PubMedCentral': '8760439', 'DOI': '10.1016/j.heliyon.2022.e08717', 'CorpusId': 245805433, 'PubMed': '35059515'}","{'id': '7fb8eddb-8838-4519-b764-4136eafd8225', 'name': 'Heliyon', 'type': 'journal', 'issn': '2405-8440', 'url': 'https://www.journals.elsevier.com/heliyon', 'alternate_urls': ['https://www.heliyon.com/', 'http://www.sciencedirect.com/science/journal/24058440', 'http://www.heliyon.com/']}",Relationship between benign paroxysmal positional vertigo (BPPV) and sleep quality,2022,27,16,"{'url': 'http://www.cell.com/article/S2405844022000056/pdf', 'status': 'GOLD', 'license': 'CCBYNCND', 'disclaimer': 'Notice: Paper or abstract available at https://pmc.ncbi.nlm.nih.gov/articles/PMC8760439, which is subject to the license by the author or copyright owner provided with this content. Please go to the source to verify the license and copyright information for your use.'}","{'name': 'Heliyon', 'volume': '8'}","{'bibtex': '@Article{Iranfar2022RelationshipBB,\n author = {Khosro Iranfar and Samaeh Azad},\n booktitle = {Heliyon},\n journal = {Heliyon},\n title = {Relationship between benign paroxysmal positional vertigo (BPPV) and sleep quality},\n volume = {8},\n year = {2022}\n}\n'}","[{'authorId': '16216388', 'name': 'Khosro Iranfar'}, {'authorId': '2149109568', 'name': 'Samaeh Azad'}]","Background Benign paroxysmal positional vertigo (BPPV) is a common cause of vertigo precipitated mainly by changes in head position for example during sleep. The relationship between sleep quality and BPPV has not been studied sufficiently. We decided to compare sleep quality between posterior canal BPPV patients and controls. Methods A total of 120 patients with posterior canal BPPV and 120 controls without BPPV were included. Demographic data as well as body mass index (BMI), cigarette smoking and medical history of the subjects were documented. The sleep quality of the participants was assessed using the Pittsburgh Sleep Quality Index (PSQI). Results Mean scores in subjective sleep quality (0.48 vs. 0.19; P = 0.002), sleep disturbances (2.97 vs. 1.85; P = 0.007), use of sleep medications (0.6 vs. 0.25; P = 0.001), and daytime dysfunction (0.76 vs. 0.47; P = 0.07) were significantly higher in the BPPV group than in control group. Poor sleep quality (i.e., total PSQI score >5) was found in 42 patients in the BPPV group (35%) and in 16 controls (13.3%); P < 0.001. Poor sleep quality was significantly more common in those whose vertigo attacks had been started more than 12 months earlier (19 of 33 cases, 57.6%) than the patients whose symptoms had started in the past 12 months (23 of 87 cases, 26.4%); P = 0.001. Conclusion Patients with posterior canal BPPV have poorer sleep quality when compared to controls without this condition, especially in women and those with disease duration longer than 12 months. These finding suggest that close attention should be paid to sleep quality of patients with BPPV."
8cce16cdaf71d922c946a7ce2c96e37b44011155,"{'DOI': '10.1016/j.anl.2022.05.011', 'CorpusId': 249334435, 'PubMed': '35659787'}","{'id': '011a90c7-7490-45ee-ae3e-63c72d01a408', 'name': 'Auris, nasus, larynx', 'type': 'journal', 'alternate_names': ['Auris nasus larynx', 'Auris Nasus Larynx'], 'issn': '0385-8146', 'url': 'https://www.journals.elsevier.com/auris-nasus-larynx'}",Relationship of vitamin D levels with clinical presentation and recurrence of BPPV in a Southeastern United States institution.,2022,54,12,"{'url': '', 'status': None, 'license': None, 'disclaimer': 'Notice: Paper or abstract available at https://api.unpaywall.org/v2/10.1016/j.anl.2022.05.011?email=<INSERT_YOUR_EMAIL> or https://doi.org/10.1016/j.anl.2022.05.011, which is subject to the license by the author or copyright owner provided with this content. Please go to the source to verify the license and copyright information for your use.'}","{'name': 'Auris, nasus, larynx'}","{'bibtex': '@Article{Cobb2022RelationshipOV,\n author = {L. H. Cobb and Victoria O. Bailey and Yuan F. Liu and M. Teixido and H. Rizk},\n booktitle = {Auris, nasus, larynx},\n journal = {Auris, nasus, larynx},\n title = {Relationship of vitamin D levels with clinical presentation and recurrence of BPPV in a Southeastern United States institution.},\n year = {2022}\n}\n'}","[{'authorId': '1428970443', 'name': 'L. H. Cobb'}, {'authorId': '2076180717', 'name': 'Victoria O. Bailey'}, {'authorId': '2052682066', 'name': 'Yuan F. Liu'}, {'authorId': '49443804', 'name': 'M. Teixido'}, {'authorId': '5928782', 'name': 'H. Rizk'}]","OBJECTIVE
To examine the relationship of 25hydroxyvitamin D serum levels with BPPV incidence and recurrence rates.


METHODS
A retrospective cross-sectional, case-controlled study with follow-up phone survey was performed on patients diagnosed with BPPV between 05/2017-05/2020, who had available 25hydroxyvitamin D serology. Patients were seen at a multidisciplinary, vestibular-focused, neurotology clinic at a tertiary referral center. Controls consisted of subjects from the National Health and Nutrition Examination Survey (NHANES), and a locoregional age, sex, and race-matched group of patients from our institution.


RESULTS
Our BPPV cohort consisted of 173 patients (mean age 66.2 ± 11.8 years), who were predominately female (75.7%) and Caucasian (76.3%). Almost all age subgroups (BPPV, NHANES, and locoregional groups) ≤60 years old had insufficient levels of vitamin D. However, the overall BPPV cohort had a significantly higher vitamin D level than the NHANES control (31.4 ± 16.5 v. 26.0 ± 11.2 ng/mL, d=0.474 [0.323, 0.626]). There was no significant difference when compared to the overall locoregional control (31.4 ± 20.5 ng/mL). Migraines were significantly correlated to increased BPPV recurrence rates on univariate (beta=0.927, p=0.037, 95% CI: [0.057, 1.798]) and multiple regression analyses (beta=0.231, 95% CI: [0.024, 2.029], p=0.045). Furthermore, patients with BPPV recurrences had significantly lower levels of vitamin D at initial presentation when compared to patients with no recurrences (29.0 ± 12.0 v. 37.6 ± 18.3 ng/mL, d=0.571[0.139,1.001]).


CONCLUSION
Many BPPV patients in our cohort had insufficient vitamin D levels, and patients with BPPV recurrences had insufficient and significantly lower vitamin D levels than those without. As a readily available and affordable supplement, vitamin D may be used as an adjunct treatment but prospective studies should be done to confirm if it can prevent or reduce recurrence."
79a3a67637ad01c205539e7803960da9728bf355,"{'PubMedCentral': '10339271', 'DOI': '10.4274/tao.2022.2022-8-6', 'CorpusId': 259530664, 'PubMed': '37456598'}","{'id': 'c379eaa2-6f66-4a66-ac55-8160f0d8762c', 'name': 'Turkish Archives of Otorhinolaryngology', 'type': 'journal', 'alternate_names': ['Turk Arch Otorhinolaryngol'], 'issn': '2667-7466', 'alternate_issns': ['2667-7474'], 'url': 'https://www.turkarchotolaryngol.net/eng/Anasayfa'}","Investigation of the Relationship Between BPPV with Anxiety, Sleep Quality and Falls",2022,35,12,"{'url': 'https://doi.org/10.4274/tao.2022.2022-8-6', 'status': 'GOLD', 'license': 'CCBYNC', 'disclaimer': 'Notice: Paper or abstract available at https://pmc.ncbi.nlm.nih.gov/articles/PMC10339271, which is subject to the license by the author or copyright owner provided with this content. Please go to the source to verify the license and copyright information for your use.'}","{'name': 'Turkish Archives of Otorhinolaryngology', 'pages': '199 - 205', 'volume': '60'}","{'bibtex': '@Article{Cengi̇z2022InvestigationOT,\n author = {D. Cengi̇z and Ismail Demir and S. Demirel and Sanem Can Çolak and Tuğba Emekçi and T. Bayındır},\n booktitle = {Turkish Archives of Otorhinolaryngology},\n journal = {Turkish Archives of Otorhinolaryngology},\n pages = {199 - 205},\n title = {Investigation of the Relationship Between BPPV with Anxiety, Sleep Quality and Falls},\n volume = {60},\n year = {2022}\n}\n'}","[{'authorId': '83697853', 'name': 'D. Cengi̇z'}, {'authorId': '2164791585', 'name': 'Ismail Demir'}, {'authorId': '2037840519', 'name': 'S. Demirel'}, {'authorId': '2221999670', 'name': 'Sanem Can Çolak'}, {'authorId': '2007980774', 'name': 'Tuğba Emekçi'}, {'authorId': '6071281', 'name': 'T. Bayındır'}]","Objective: To investigate the effects of dizziness on sleep quality and psychological status in patients with benign paroxysmal positional vertigo (BPPV) and to evaluate its relationship with falls. Methods: A Demographic Data Form, a Visual Vertigo Analog Scale, the Falls Efficacy Scale - International (FES-I), the Hospital Anxiety and Depression Scale (HADS), and the Pittsburgh Sleep Quality Index (PSQI) were administered in 102 individuals diagnosed with BPPV by videonystagmography test. The same scales were applied to 75 healthy volunteers as the control group, and the two groups were compared. The BPPV group was divided into two groups as posterior canal and lateral canal BPPV. These two groups were compared among themselves and with the control group. Results: A statistically significant difference was found between the BPPV and control groups, the lateral canal BPPV and posterior canal BPPV groups, the lateral canal BPPV and control groups, and the posterior canal BPPV and control groups in terms of total scores of the PSQI, the FES-I, and the HADS (p<0.001). In the regression model, the FES-I score was fully explained by the PSQI and HADS scores (p<0.001). Conclusion: BPPV significantly affects sleep quality, psychological state, and the risk of fall. The negative effects of BPPV restrict daily living activities, affect the prognosis of the disease, and increase the risk of falling. Considering that psychiatric issues and sleep problems increase the risk of falling in individuals with BPPV, counseling services on this issue would reduce the incidence of falls and related injuries."
