paperId,externalIds,publicationVenue,title,year,referenceCount,citationCount,openAccessPdf,journal,citationStyles,authors,abstract
ff48995a1d461abc5762aacfe3eae09a12b906c1,"{'PubMedCentral': '8395413', 'DOI': '10.3390/audiolres11030039', 'CorpusId': 237338000, 'PubMed': '34449541'}","{'id': '4fb9e270-36b0-40db-b91a-b9d3a1066f66', 'name': 'Audiology Research', 'type': 'journal', 'alternate_names': ['Audiology research', 'Audiol Res', 'Audiol res'], 'issn': '2039-4330', 'alternate_issns': ['2039-4349'], 'url': 'http://audiologyresearch.org/', 'alternate_urls': ['https://www.audiologyresearch.org/index.php/audio', 'https://www.mdpi.com/journal/audiolres', 'https://www.pagepressjournals.org/index.php/audio/index']}",Benign Paroxysmal Positional Vertigo (BPPV) in COVID-19,2021,17,26,"{'url': 'https://www.mdpi.com/2039-4349/11/3/39/pdf?version=1628839239', 'status': 'GOLD', 'license': 'CCBY', 'disclaimer': 'Notice: Paper or abstract available at https://pmc.ncbi.nlm.nih.gov/articles/PMC8395413, which is subject to the license by the author or copyright owner provided with this content. Please go to the source to verify the license and copyright information for your use.'}","{'name': 'Audiology Research', 'pages': '418 - 422', 'volume': '11'}","{'bibtex': '@Article{Picciotti2021BenignPP,\n author = {P. Picciotti and G. Passali and B. Sergi and E. de Corso},\n booktitle = {Audiology Research},\n journal = {Audiology Research},\n pages = {418 - 422},\n title = {Benign Paroxysmal Positional Vertigo (BPPV) in COVID-19},\n volume = {11},\n year = {2021}\n}\n'}","[{'authorId': '145282768', 'name': 'P. Picciotti'}, {'authorId': '2860350', 'name': 'G. Passali'}, {'authorId': '6114756', 'name': 'B. Sergi'}, {'authorId': '6077105', 'name': 'E. de Corso'}]","Objective: The purpose of this article is to describe BPPV in COVID-19 patients by discussing the possible mechanisms underlying the onset of this vertigo. Methods: We studied eight patients (4 F, 4 M, aged between 44 and 69 years) with COVID-19 infections complaining of vertigo. Patients were evaluated at the end of infection with an accurate clinical history, and the investigation of spontaneous, positional and positioning nystagmus. Results: The vestibular findings showed benign paroxysmal positional vertigo (BPPV) in all the patients. Three patients had a mild phenotype of the COVID infection, whereas five subjects were hospitalized for the COVID infection and in three cases intensive care was required. Vestibular evaluation showed an involvement of posterior semicircular canals in five patients and horizontal in three. Three patients were treated with the Epley maneuver, two with Semont, one with Lempert and two with Gufoni maneuvers. Conclusions: We hypothesize that BPPV in COVID-19 infections can be relate to drugs, prolonged bed rest and to direct damage by viral infection on the peripheral vestibular system and in particular on the otolitic membrane due to the cytopathic effect of the virus and to the inflammatory response. Studies on large series of patients are needed to confirm our preliminary observation and to better evaluate the pathophysiological mechanisms underlying BPPV in these patients."
adeaf8dda519b8862f996f4d6d61a54306411081,"{'DOI': '10.1016/j.amjoto.2022.103474', 'CorpusId': 248611286, 'PubMed': '35561430'}","{'id': '0776fdb3-260c-4f3b-b9d8-30181d32c49d', 'name': 'American Journal of Otolaryngology', 'type': 'journal', 'alternate_names': ['Am J Otolaryngol'], 'issn': '0196-0709', 'url': 'http://www.harcourthealth.com/amjoto', 'alternate_urls': ['http://www.sciencedirect.com/science/journal/01960709']}",Is it possible to diagnose Posterior Semicircular Canal BPPV from the sitting position? The role of the Head Pitch Test and the upright tests along the RALP and LARP planes.,2022,35,9,"{'url': '', 'status': None, 'license': None, 'disclaimer': 'Notice: Paper or abstract available at https://api.unpaywall.org/v2/10.1016/j.amjoto.2022.103474?email=<INSERT_YOUR_EMAIL> or https://doi.org/10.1016/j.amjoto.2022.103474, which is subject to the license by the author or copyright owner provided with this content. Please go to the source to verify the license and copyright information for your use.'}","{'name': 'American journal of otolaryngology', 'pages': '\n          103474\n        ', 'volume': '43 4'}","{'bibtex': '@Article{Martellucci2022IsIP,\n author = {S. Martellucci and Andrea Castellucci and P. Malara and G. Ralli and G. Pagliuca and C. Botti and A. Gallo and A. Ghidini and G. Asprella Libonati},\n booktitle = {American Journal of Otolaryngology},\n journal = {American journal of otolaryngology},\n pages = {\n          103474\n        },\n title = {Is it possible to diagnose Posterior Semicircular Canal BPPV from the sitting position? The role of the Head Pitch Test and the upright tests along the RALP and LARP planes.},\n volume = {43 4},\n year = {2022}\n}\n'}","[{'authorId': '5940038', 'name': 'S. Martellucci'}, {'authorId': '144284214', 'name': 'Andrea Castellucci'}, {'authorId': '66765249', 'name': 'P. Malara'}, {'authorId': '6474829', 'name': 'G. Ralli'}, {'authorId': '34784015', 'name': 'G. Pagliuca'}, {'authorId': '18439042', 'name': 'C. Botti'}, {'authorId': '119156830', 'name': 'A. Gallo'}, {'authorId': '12798838', 'name': 'A. Ghidini'}, {'authorId': '133991353', 'name': 'G. Asprella Libonati'}]","PURPOSE
The diagnosis of benign paroxysmal positional vertigo (BPPV) involving the posterior semicircular canal (PSC) is traditionally entrusted to positioning tests where patients are rapidly brought in the supine position. This prospective study aims to define the role of a diagnostic protocol for PSC-BPPV including only upright tests.


MATERIALS AND METHODS
109 patients with PSC-BPPV were enrolled. The Head Pitch Test (HPT) was carried out first. If uneventful, the patient's head was turned 45° to each side and bent back-and-forth along the plane aligning either with the right anterior-left posterior (RALP) or left anterior-right posterior (LARP) canals, thus performing the upright RALP / upright LARP (uRALP/uLARP) test. Nystagmus observed was used to predict the diagnosis, which was therefore confirmed by Dix-Hallpike tests.


RESULTS
PSC-BPPV could be correctly diagnosed in 75.2% of cases with the sole HPT and in 87.2% of cases by adding the uRALP/uLARP test (Upright Protocol). The time elapsed from symptoms onset was closely related to the protocol sensitivity, as it reached 100% (64/64) in acute patients while decreased to 68.9% (31/45) in cases evaluated after 7 days (p < 0.001).


CONCLUSIONS
Upright maneuvers could correctly diagnose PSC-BPPV in most cases. uRALP/uLARP test demonstrated to improve the sensitivity of the HPT, mainly in recent-onset BPPV."
620368f0a82b01967eae6f75521f5cc7c66dc1f6,"{'PubMedCentral': '8497794', 'DOI': '10.3389/fneur.2021.740599', 'CorpusId': 237610682, 'PubMed': '34630309'}","{'id': '3513ce18-3757-4358-b15f-7060af98e6d0', 'name': 'Frontiers in Neurology', 'type': 'journal', 'alternate_names': ['Front Neurol'], 'issn': '1664-2295', 'url': 'https://www.frontiersin.org/journals/neurology', 'alternate_urls': ['http://www.frontiersin.org/neurology/about', 'http://frontiersin.org/neurology']}",Diagnostic and Therapeutic Maneuvers for Anterior Canal BPPV Canalithiasis: Three-Dimensional Simulations,2021,35,28,"{'url': 'https://www.frontiersin.org/articles/10.3389/fneur.2021.740599/pdf', 'status': 'GOLD', 'license': 'CCBY', 'disclaimer': 'Notice: Paper or abstract available at https://pmc.ncbi.nlm.nih.gov/articles/PMC8497794, which is subject to the license by the author or copyright owner provided with this content. Please go to the source to verify the license and copyright information for your use.'}","{'name': 'Frontiers in Neurology', 'volume': '12'}","{'bibtex': '@Article{Bhandari2021DiagnosticAT,\n author = {A. Bhandari and Rajneesh Bhandari and H. Kingma and M. Strupp},\n booktitle = {Frontiers in Neurology},\n journal = {Frontiers in Neurology},\n title = {Diagnostic and Therapeutic Maneuvers for Anterior Canal BPPV Canalithiasis: Three-Dimensional Simulations},\n volume = {12},\n year = {2021}\n}\n'}","[{'authorId': '36823847', 'name': 'A. Bhandari'}, {'authorId': '145985356', 'name': 'Rajneesh Bhandari'}, {'authorId': '2195379', 'name': 'H. Kingma'}, {'authorId': '1930513', 'name': 'M. Strupp'}]","Background and Objectives: Anterior canal BPPV is a rare BPPV variant. Various diagnostic and therapeutic maneuvers have been described for its management. The aim of this study was to use three-dimensional simulation models to visualize otoconial debris movement within the anterior canal during diagnostic tests and different liberatory maneuvers. This can help to optimize existing treatment maneuvers and help in the development of better management protocols. Methods: Based on reconstructed MRI images and fluid dynamics, a 3D dynamic simulation model (as a function of time) was developed and applied. Simulations of the supine head-hanging test for diagnosis of ac-BPPV were studied. Three repositioning maneuvers were simulated: 1) the Yacovino maneuver and its modifications, 2) the reverse Epley maneuver and 3) the short canal repositioning (CRP) maneuver. Results: The simulation showed that the supine head-hanging test is a good test for diagnosis of ac-BPPV affecting both labyrinths and demonstrated why there is no inversion of nystagmus on sitting up. The Yacovino maneuver was seen to be an effective treatment option for ac-BPPV without having to determine the side involved. However, simulations showed that the classical Yacovino maneuver carried a risk of canal switch to the posterior canal. To overcome this risk, a modified Yacovino maneuver is suggested. The reverse Epley maneuver was not an effective treatment. Short CRP is useful in ac-BPPV treatment; however, it requires determination of side of involvement. Conclusion: The 3D simulator of the movement of the otoconial debris presented here can be used to test the mechanism of action and the theoretical efficacy of existing diagnostic tests and maneuvers as well as to develop new treatment maneuvers to optimize BPPV treatment."
e1c3c4222a48de2e64d4212f415eaaf5f1f79706,"{'PubMedCentral': '8032929', 'DOI': '10.3389/fneur.2021.632286', 'CorpusId': 232358591, 'PubMed': '33841305'}","{'id': '3513ce18-3757-4358-b15f-7060af98e6d0', 'name': 'Frontiers in Neurology', 'type': 'journal', 'alternate_names': ['Front Neurol'], 'issn': '1664-2295', 'url': 'https://www.frontiersin.org/journals/neurology', 'alternate_urls': ['http://www.frontiersin.org/neurology/about', 'http://frontiersin.org/neurology']}",BPPV Simulation: A Powerful Tool to Understand and Optimize the Diagnostics and Treatment of all Possible Variants of BPPV,2021,27,21,"{'url': 'https://www.frontiersin.org/articles/10.3389/fneur.2021.632286/pdf', 'status': 'GOLD', 'license': 'CCBY', 'disclaimer': 'Notice: Paper or abstract available at https://pmc.ncbi.nlm.nih.gov/articles/PMC8032929, which is subject to the license by the author or copyright owner provided with this content. Please go to the source to verify the license and copyright information for your use.'}","{'name': 'Frontiers in Neurology', 'volume': '12'}","{'bibtex': '@Article{Bhandari2021BPPVSA,\n author = {A. Bhandari and H. Kingma and Rajneesh Bhandari},\n booktitle = {Frontiers in Neurology},\n journal = {Frontiers in Neurology},\n title = {BPPV Simulation: A Powerful Tool to Understand and Optimize the Diagnostics and Treatment of all Possible Variants of BPPV},\n volume = {12},\n year = {2021}\n}\n'}","[{'authorId': '36823847', 'name': 'A. Bhandari'}, {'authorId': '2195379', 'name': 'H. Kingma'}, {'authorId': '145985356', 'name': 'Rajneesh Bhandari'}]","BPPV is a mechanical disorder caused by the displacement of otolith debris into the semicircular canals. The treatment involves different repositioning maneuvers to bring the debris back into the utricle. This study aims to show how dynamic simulation models based on fluid dynamics and MRI, can help to visualize and understand the movement of the debris within the canals during head movement in 3D as a function of time. The user can define the rotation angle and plane at each step of the maneuver and then the model visualizes the canal and the otoconial movement in 3D. The simulation developed also allows alteration of various parameters like the rotational head acceleration, the duration of each step of the maneuver, the initial position of the otoconial debris in the canal, the size and the number of the particles and fluid dynamics of endolymph. The clod movement is visualized in such a way that it allows a better understanding of the impact and efficacy of various liberation maneuvers and why certain maneuvers might fail when not applied properly in the clinic. The model allows simulation of multi-canal BPPV. In this paper we demonstrate the power of the model applied on the maneuvers of Semont and Yacovino when executed in different ways. The model aims to provide a visual explanation for the need of specific maneuvers for each type of BPPV. The simulator presented here can be used to test the efficacy of existing maneuvers and help in the development of new maneuvers to treat different BPPV variants."
e44f540508ba31202d2266a7d7cbd40958fba046,"{'PubMedCentral': '8356850', 'DOI': '10.1002/lio2.619', 'CorpusId': 236980301, 'PubMed': '34401514'}","{'id': '0dd61f76-728d-45bd-8f99-a83262df69d3', 'name': 'Laryngoscope Investigative Otolaryngology', 'alternate_names': ['Laryngoscope Investig Otolaryngol'], 'issn': '2378-8038', 'url': 'http://onlinelibrary.wiley.com/journal/10.1002/(ISSN)2378-8038', 'alternate_urls': ['https://onlinelibrary.wiley.com/journal/23788038']}",Comparison of outcomes of the Epley and Semont maneuvers in posterior canal BPPV: A randomized controlled trial,2021,24,18,"{'url': 'https://www.ncbi.nlm.nih.gov/pmc/articles/PMC8356850', 'status': 'GREEN', 'license': 'CCBYNCND', 'disclaimer': 'Notice: Paper or abstract available at https://pmc.ncbi.nlm.nih.gov/articles/PMC8356850, which is subject to the license by the author or copyright owner provided with this content. Please go to the source to verify the license and copyright information for your use.'}","{'name': 'Laryngoscope Investigative Otolaryngology', 'pages': '866 - 871', 'volume': '6'}","{'bibtex': '@Article{Sinsamutpadung2021ComparisonOO,\n author = {Chayada Sinsamutpadung and Anan Kulthaveesup},\n booktitle = {Laryngoscope Investigative Otolaryngology},\n journal = {Laryngoscope Investigative Otolaryngology},\n pages = {866 - 871},\n title = {Comparison of outcomes of the Epley and Semont maneuvers in posterior canal BPPV: A randomized controlled trial},\n volume = {6},\n year = {2021}\n}\n'}","[{'authorId': '2123020004', 'name': 'Chayada Sinsamutpadung'}, {'authorId': '2098391913', 'name': 'Anan Kulthaveesup'}]","This study aims to compare the efficacy of the Epley and Semont maneuvers in relieving posterior canal benign paroxysmal positional vertigo (BPPV) arising in the in patients at the Outpatient Department of the Department of Otolaryngology, Faculty of Medicine Vajira Hospital, Navamindradhiraj University, Bangkok, Thailand."
c8fe4aff0c5e324e3407a485f445e756999d4db5,"{'PubMedCentral': '7851369', 'DOI': '10.1055/s-0040-1722252', 'CorpusId': 231787035, 'PubMed': '33542764'}","{'id': '80b3c35a-9114-4250-9d83-df8a442cafff', 'name': 'International Archives of Otorhinolaryngology', 'type': 'journal', 'alternate_names': ['Int Arch Otorhinolaryngol'], 'issn': '1809-4864', 'url': 'http://www.arquivosdeorl.org.br/english/', 'alternate_urls': ['https://www.scielo.br/scielo.php?lng=en&pid=1809-4864&script=sci_serial', 'http://www.thieme.com/iao', 'https://www.scielo.br/scielo.php?lng=en&nrm=iso&pid=1809-4864&script=sci_serial', 'https://www.thieme.com/books-main/otolaryngology/product/2200-international-archives-of-otorhinolaryngology']}",Teleconsultation and Teletreatment Protocol to Diagnose and Manage Patients with Benign Paroxysmal Positional Vertigo (BPPV) during the COVID-19 Pandemic,2021,53,19,"{'url': 'https://doi.org/10.1055/s-0040-1722252', 'status': 'GOLD', 'license': 'CCBYNCND', 'disclaimer': 'Notice: Paper or abstract available at https://pmc.ncbi.nlm.nih.gov/articles/PMC7851369, which is subject to the license by the author or copyright owner provided with this content. Please go to the source to verify the license and copyright information for your use.'}","{'name': 'International Archives of Otorhinolaryngology', 'pages': 'e141 - e149', 'volume': '25'}","{'bibtex': '@Article{Barreto2021TeleconsultationAT,\n author = {R. Barreto and D. Yacovino and L. J. Teixeira and M. Freitas},\n booktitle = {International Archives of Otorhinolaryngology},\n journal = {International Archives of Otorhinolaryngology},\n pages = {e141 - e149},\n title = {Teleconsultation and Teletreatment Protocol to Diagnose and Manage Patients with Benign Paroxysmal Positional Vertigo (BPPV) during the COVID-19 Pandemic},\n volume = {25},\n year = {2021}\n}\n'}","[{'authorId': '2072163585', 'name': 'R. Barreto'}, {'authorId': '4502770', 'name': 'D. Yacovino'}, {'authorId': '1406072961', 'name': 'L. J. Teixeira'}, {'authorId': '2057179111', 'name': 'M. Freitas'}]","Abstract Introduction Telehealth consists in the application of technology to provide remote health service. This resource is considered safe and effective and has attracted an exponential interest in the context of the COVID pandemic. Expanded to dizzy patients, it would be able to provide diagnosis and treatment, minimizing the risk of disease transmission. Benign paroxysmal positional vertigo (BPPV) is the most common vestibular disorder. The diagnosis typically rests on the description of the symptoms along with the nystagmus observed at a well-established positional testing. Objectives The aim of the present study was to propose a teleconsultation and teletreatment protocol to manage patients with BPPV during the COVID-19 pandemic. Methods Specialists in the vestibular field met through remote access technologies to discuss the best strategy to manage BPPV patients by teleconsultation and teletreatment system. Additionally, several scientific sources were consulted. Technical issues, patient safety, and clinical assessment were independently analyzed. All relevant information was considered in order to design a clinical protocol to manage BPPV patients in the pandemic context. Results Teleconsultation for BPPV patients requires a double way (video and audio) digital system. An adapted informed consent to follow good clinical practice statements must be considered. The time, trigger and target eye bedside examination (TiTRaTe) protocol has proven to be a valuable first approach. The bow and lean test is the most rational screening maneuver for patients with suspected positional vertigo, followed by most specific maneuvers to diagnostic the sub-variants of BPPV. Conclusion Although with limited evidence, teleconsultation and teletreatment are both reasonable and feasible strategies for the management of patients with BPPV in adverse situations for face-to-face consultation."
