paperId,externalIds,publicationVenue,title,year,referenceCount,citationCount,openAccessPdf,journal,citationStyles,authors,abstract
e477a526cddcb364fee2744e938c9f91bd0c34d4,"{'PubMedCentral': '11157684', 'DOI': '10.3389/fneur.2024.1382196', 'CorpusId': 270011416, 'PubMed': '38854956'}","{'id': '3513ce18-3757-4358-b15f-7060af98e6d0', 'name': 'Frontiers in Neurology', 'type': 'journal', 'alternate_names': ['Front Neurol'], 'issn': '1664-2295', 'url': 'https://www.frontiersin.org/journals/neurology', 'alternate_urls': ['http://www.frontiersin.org/neurology/about', 'http://frontiersin.org/neurology']}",Residual dizziness after BPPV management: exploring pathophysiology and treatment beyond canalith repositioning maneuvers,2024,129,30,"{'url': 'https://www.frontiersin.org/journals/neurology/articles/10.3389/fneur.2024.1382196/pdf', 'status': 'GOLD', 'license': 'CCBY', 'disclaimer': 'Notice: Paper or abstract available at https://pmc.ncbi.nlm.nih.gov/articles/PMC11157684, which is subject to the license by the author or copyright owner provided with this content. Please go to the source to verify the license and copyright information for your use.'}","{'name': 'Frontiers in Neurology', 'volume': '15'}","{'bibtex': '@Article{Özgirgin2024ResidualDA,\n author = {O. N. Özgirgin and H. Kingma and L. Manzari and Michel Lacour},\n booktitle = {Frontiers in Neurology},\n journal = {Frontiers in Neurology},\n title = {Residual dizziness after BPPV management: exploring pathophysiology and treatment beyond canalith repositioning maneuvers},\n volume = {15},\n year = {2024}\n}\n'}","[{'authorId': '2099013108', 'name': 'O. N. Özgirgin'}, {'authorId': '2303056886', 'name': 'H. Kingma'}, {'authorId': '6637368', 'name': 'L. Manzari'}, {'authorId': '2253142341', 'name': 'Michel Lacour'}]","Despite the high success rate of canalith repositioning maneuvers (CRMs) in the treatment of benign paroxysmal positional vertigo (BPPV), a growing number of patients report residual dizziness symptoms that may last for a significant time. Although the majority of BPPV cases can be explained by canalolithiasis, the etiology is complex. Consideration of the individual patient’s history and underlying pathophysiology of BPPV may offer the potential for treatment approaches supplementary to CRMs, as well as a promising alternative for patients in whom CRMs are contraindicated. This article provides a summary of the possible underlying causes of BPPV and residual dizziness, along with suggestions for potential management options that may be considered to relieve the burden of residual symptoms."
4c6ba9f745fbba90d6665ec4dab40388b97786a7,"{'PubMedCentral': '11175138', 'DBLP': 'journals/sensors/MunKLHCJK24', 'DOI': '10.3390/s24113417', 'CorpusId': 270077933, 'PubMed': '38894208'}","{'id': '3dbf084c-ef47-4b74-9919-047b40704538', 'name': 'Italian National Conference on Sensors', 'type': 'conference', 'alternate_names': ['SENSORS', 'IEEE Sens', 'Ital National Conf Sens', 'IEEE Sensors', 'Sensors'], 'issn': '1424-8220', 'url': 'http://www.e-helvetica.nb.admin.ch/directAccess?callnumber=bel-142001', 'alternate_urls': ['http://nbn-resolving.de/urn/resolver.pl?urn=urn:nbn:ch:bel-142001', 'http://www.mdpi.com/journal/sensors', 'https://www.mdpi.com/journal/sensors']}",Deep Learning-Based Nystagmus Detection for BPPV Diagnosis,2024,27,14,"{'url': 'https://www.mdpi.com/1424-8220/24/11/3417/pdf?version=1716704738', 'status': 'GOLD', 'license': 'CCBY', 'disclaimer': 'Notice: Paper or abstract available at https://pmc.ncbi.nlm.nih.gov/articles/PMC11175138, which is subject to the license by the author or copyright owner provided with this content. Please go to the source to verify the license and copyright information for your use.'}","{'name': 'Sensors (Basel, Switzerland)', 'volume': '24'}","{'bibtex': '@Article{Mun2024DeepLN,\n author = {Sae Byeol Mun and Young Jae Kim and J. Lee and Gyu-Cheol Han and Sung Ho Cho and Seok Jin and Kwang Gi Kim},\n booktitle = {Italian National Conference on Sensors},\n journal = {Sensors (Basel, Switzerland)},\n title = {Deep Learning-Based Nystagmus Detection for BPPV Diagnosis},\n volume = {24},\n year = {2024}\n}\n'}","[{'authorId': '2303553955', 'name': 'Sae Byeol Mun'}, {'authorId': '2253114932', 'name': 'Young Jae Kim'}, {'authorId': '4612691', 'name': 'J. Lee'}, {'authorId': '2203122587', 'name': 'Gyu-Cheol Han'}, {'authorId': '2149157151', 'name': 'Sung Ho Cho'}, {'authorId': '2303811420', 'name': 'Seok Jin'}, {'authorId': '2144602279', 'name': 'Kwang Gi Kim'}]","In this study, we propose a deep learning-based nystagmus detection algorithm using video oculography (VOG) data to diagnose benign paroxysmal positional vertigo (BPPV). Various deep learning architectures were utilized to develop and evaluate nystagmus detection models. Among the four deep learning architectures used in this study, the CNN1D model proposed as a nystagmus detection model demonstrated the best performance, exhibiting a sensitivity of 94.06 ± 0.78%, specificity of 86.39 ± 1.31%, precision of 91.34 ± 0.84%, accuracy of 91.02 ± 0.66%, and an F1-score of 92.68 ± 0.55%. These results indicate the high accuracy and generalizability of the proposed nystagmus diagnosis algorithm. In conclusion, this study validates the practicality of deep learning in diagnosing BPPV and offers avenues for numerous potential applications of deep learning in the medical diagnostic sector. The findings of this research underscore its importance in enhancing diagnostic accuracy and efficiency in healthcare."
7d2038d91afe0048cba508c50103520be196524e,"{'PubMedCentral': '11043747', 'DOI': '10.1136/bmjopen-2023-077986', 'CorpusId': 269329741, 'PubMed': '38653514'}","{'id': 'e6216b43-2428-4aaf-8101-b40e1dfd2810', 'name': 'BMJ Open', 'type': 'journal', 'issn': '2044-6055', 'url': 'https://bmjopen.bmj.com/', 'alternate_urls': ['http://bmjopen.bmj.com/']}",Association between vitamin D deficiency and benign paroxysmal positional vertigo (BPPV) incidence and recurrence: a systematic review and meta-analysis,2024,60,18,"{'url': 'https://bmjopen.bmj.com/content/bmjopen/14/4/e077986.full.pdf', 'status': 'GOLD', 'license': 'CCBY', 'disclaimer': 'Notice: Paper or abstract available at https://pmc.ncbi.nlm.nih.gov/articles/PMC11043747, which is subject to the license by the author or copyright owner provided with this content. Please go to the source to verify the license and copyright information for your use.'}","{'name': 'BMJ Open', 'volume': '14'}","{'bibtex': '@Article{Wood2024AssociationBV,\n author = {Heather Wood and Karolina Kluk and Ghada Binkhamis},\n booktitle = {BMJ Open},\n journal = {BMJ Open},\n title = {Association between vitamin D deficiency and benign paroxysmal positional vertigo (BPPV) incidence and recurrence: a systematic review and meta-analysis},\n volume = {14},\n year = {2024}\n}\n'}","[{'authorId': '2296464792', 'name': 'Heather Wood'}, {'authorId': '2257821088', 'name': 'Karolina Kluk'}, {'authorId': '51198222', 'name': 'Ghada Binkhamis'}]","Objectives The objective of this study is to determine the relationship between serum vitamin D level and the risk of developing benign paroxysmal positional vertigo (BPPV) incidence and recurrence in countries in the Northern Hemisphere. Design Systematic review and meta-analysis. Data sources PubMed, Scopus and Web of Science databases were searched for studies published between January 2000 and February 2023. Eligibility criteria for selecting studies Participants located in the Northern Hemisphere aged 18 or over with at least one episode of BPPV, serum 25-hydroxyvitamin D levels measured and reported, no comorbidities or history of vitamin D supplementation. Data extraction and synthesis Data extraction and synthesis were performed by a single reviewer and checked by a second reviewer. Inclusion and exclusion criteria and risk of bias were assessed by two independent reviewers using the Newcastle Ottawa Tool for Cohort studies and Risk of Bias Assessment Tool for Nonrandomised Studies checklist for case–control studies. Meta-analysis was conducted using random effects models. Standard mean difference with a 95% CI was used to measure the relationship between vitamin D level and BPPV. Results The 35 articles identified by the literature search reported data of 9843 individuals. 19 studies (7387 individuals) were included in the BPPV incidence meta-analysis while 7 studies (622 individuals) were included in the BPPV recurrence meta-analysis. Lower serum vitamin D levels were found in BPPV incidence compared with controls, but the relationship between vitamin D levels in recurrent BPPV compared with non-recurrent disease remained uncertain. Conclusion Results of this systematic review and meta-analysis demonstrated a negative correlation between serum vitamin D and BPPV incidence, while any relationship between serum vitamin D and BPPV recurrence remained uncertain. Risk of bias analysis revealed evidence of variable quality. There were insufficient data available to evaluate seasonal relationships between serum vitamin D and BPPV. Given the potential for this as a confounding factor, future research should aim to investigate this further. PROSPERO registration number CRD42021271840."
d0c26c867b004afc006a219c427ac9ea17db7737,"{'PubMedCentral': '11268396', 'DOI': '10.7759/cureus.63039', 'CorpusId': 270723731, 'PubMed': '39050283'}","{'id': '87c855fc-c59a-4443-832a-e5b1ca14b9f3', 'name': 'Cureus', 'type': 'journal', 'issn': '2168-8184', 'url': 'https://www.cureus.com/'}",Understanding Benign Paroxysmal Positional Vertigo (BPPV) and Its Impact on Quality of Life: A Systematic Review,2024,39,13,"{'url': 'https://assets.cureus.com/uploads/review_article/pdf/262278/20240624-10662-fdjew8.pdf', 'status': 'GOLD', 'license': 'CCBY', 'disclaimer': 'Notice: Paper or abstract available at https://pmc.ncbi.nlm.nih.gov/articles/PMC11268396, which is subject to the license by the author or copyright owner provided with this content. Please go to the source to verify the license and copyright information for your use.'}","{'name': 'Cureus', 'volume': '16'}","{'bibtex': '@Article{Madrigal2024UnderstandingBP,\n author = {Jorge Madrigal and L. Manzari and J. J. Figueroa and Melissa Castillo-Bustamante},\n booktitle = {Cureus},\n journal = {Cureus},\n title = {Understanding Benign Paroxysmal Positional Vertigo (BPPV) and Its Impact on Quality of Life: A Systematic Review},\n volume = {16},\n year = {2024}\n}\n'}","[{'authorId': '77294627', 'name': 'Jorge Madrigal'}, {'authorId': '6637368', 'name': 'L. Manzari'}, {'authorId': '2308180319', 'name': 'J. J. Figueroa'}, {'authorId': '1783170502', 'name': 'Melissa Castillo-Bustamante'}]","Benign paroxysmal positional vertigo (BPPV) is a common vestibular disorder characterized by brief episodes of vertigo triggered by specific head movements. Despite its short duration, BPPV significantly impacts the quality of life. A comprehensive search of electronic databases, including PubMed, Scopus, and Web of Science, was performed to gather peer-reviewed articles, clinical trials, and review articles published between 2014 and 2024. Keywords used in the search included ""benign paroxysmal positional vertigo,"" ""BPPV,"" ""vestibular disorders,"" ""quality of life,"" ""diagnosis,"" and ""treatment."" Eleven articles were included in the systematic review. Tools such as the Dizziness Handicap Inventory (DHI) and the 36-Item Short Form Health Survey (SF-36) are reported to assess the impact of BPPV on quality of life. This review includes 11 articles focusing on quality of life outcomes in BPPV patients. This systematic review explores the various dimensions of quality of life affected by BPPV and the tools used to evaluate these effects. BPPV can lead to physical limitations, such as difficulty in performing daily activities, and psychological effects, including anxiety, depression, and emotional distress. Socially, BPPV can cause social withdrawal and isolation due to the fear of experiencing vertigo in public. Occupationally, BPPV can interfere with job-related tasks. Future research should focus on developing personalized treatment approaches and patient-reported outcome measures specific to BPPV. A comprehensive approach to BPPV management is essential for improving the quality of life of affected individuals."
7d1b29ef8f5e4ba0efd67d01d9a04910d60eaaa7,"{'DBLP': 'journals/midm/LuMLZ24', 'PubMedCentral': '10956181', 'DOI': '10.1186/s12911-024-02438-x', 'CorpusId': 268606670, 'PubMed': '38515156'}","{'id': '76da9cc5-c5a7-42b4-a250-3e708c5f4980', 'name': 'BMC Medical Informatics and Decision Making', 'type': 'journal', 'alternate_names': ['BMC Med Informatics Decis Mak'], 'issn': '1472-6947', 'url': 'http://www.biomedcentral.com/bmcmedinformdecismak/', 'alternate_urls': ['https://bmcmedinformdecismak.biomedcentral.com/', 'https://link.springer.com/journal/12911', 'http://www.pubmedcentral.nih.gov/tocrender.fcgi?journal=42']}",Multimodal deep learning-based diagnostic model for BPPV,2024,42,13,"{'url': 'https://bmcmedinformdecismak.biomedcentral.com/counter/pdf/10.1186/s12911-024-02438-x', 'status': 'GOLD', 'license': 'CCBY', 'disclaimer': 'Notice: Paper or abstract available at https://pmc.ncbi.nlm.nih.gov/articles/PMC10956181, which is subject to the license by the author or copyright owner provided with this content. Please go to the source to verify the license and copyright information for your use.'}","{'name': 'BMC Medical Informatics and Decision Making', 'volume': '24'}","{'bibtex': '@Article{Lu2024MultimodalDL,\n author = {Hang Lu and Yuxing Mao and Jinsen Li and Lin Zhu},\n booktitle = {BMC Medical Informatics and Decision Making},\n journal = {BMC Medical Informatics and Decision Making},\n title = {Multimodal deep learning-based diagnostic model for BPPV},\n volume = {24},\n year = {2024}\n}\n'}","[{'authorId': '2264122352', 'name': 'Hang Lu'}, {'authorId': '2239652753', 'name': 'Yuxing Mao'}, {'authorId': '2136084944', 'name': 'Jinsen Li'}, {'authorId': '2292893580', 'name': 'Lin Zhu'}]","Benign paroxysmal positional vertigo (BPPV) is a prevalent form of vertigo that necessitates a skilled physician to diagnose by observing the nystagmus and vertigo resulting from specific changes in the patient’s position. In this study, we aim to explore the integration of eye movement video and position information for BPPV diagnosis and apply artificial intelligence (AI) methods to improve the accuracy of BPPV diagnosis. We collected eye movement video and diagnostic data from 518 patients with BPPV who visited the hospital for examination from January to March 2021 and developed a BPPV dataset. Based on the characteristics of the dataset, we propose a multimodal deep learning diagnostic model, which combines a video understanding model, self-encoder, and cross-attention mechanism structure. Our validation test on the test set showed that the average accuracy of the model reached 81.7%, demonstrating the effectiveness of the proposed multimodal deep learning method for BPPV diagnosis. Furthermore, our study highlights the significance of combining head position information and eye movement information in BPPV diagnosis. We also found that postural and eye movement information plays a critical role in the diagnosis of BPPV, as demonstrated by exploring the necessity of postural information for the diagnostic model and the contribution of cross-attention mechanisms to the fusion of postural and oculomotor information. Our results underscore the potential of AI-based methods for improving the accuracy of BPPV diagnosis and the importance of considering both postural and oculomotor information in BPPV diagnosis."
6f8a6f406b34d60e5cdad278c7fd6d52b6eb44f2,"{'DOI': '10.1002/ohn.506', 'CorpusId': 261121935, 'PubMed': '37622581'}","{'id': 'b8122bd3-0514-444c-951f-85bab544f882', 'name': 'Otolaryngology Head & Neck Surgery', 'type': 'journal', 'alternate_names': ['Otolaryngol Neck Surg', 'Otolaryngology and head and neck surgery', 'Otolaryngol head neck surg', 'Otolaryngol Head  Neck Surg', 'Otolaryngology-Head and Neck Surgery'], 'issn': '2573-010X', 'alternate_issns': ['0194-5998'], 'url': 'http://www.heraldopenaccess.us/journals/Otolaryngology-Head-&-Neck-Surgery/archive.php', 'alternate_urls': ['https://journals.sagepub.com/home/oto', 'http://www.otojournal.org/']}",BPPV Information on Google Versus AI (ChatGPT).,2023,34,42,"{'url': '', 'status': 'CLOSED', 'license': None, 'disclaimer': 'Notice: Paper or abstract available at https://api.unpaywall.org/v2/10.1002/ohn.506?email=<INSERT_YOUR_EMAIL> or https://doi.org/10.1002/ohn.506, which is subject to the license by the author or copyright owner provided with this content. Please go to the source to verify the license and copyright information for your use.'}",{'name': 'Otolaryngology--head and neck surgery : official journal of American Academy of Otolaryngology-Head and Neck Surgery'},"{'bibtex': '@Article{Bellinger2023BPPVIO,\n author = {Jeffrey R. Bellinger and Julian S. De La Chapa and Minhie W Kwak and Gabriel A Ramos and D. Morrison and B. Kesser},\n booktitle = {Otolaryngology Head & Neck Surgery},\n journal = {Otolaryngology--head and neck surgery : official journal of American Academy of Otolaryngology-Head and Neck Surgery},\n title = {BPPV Information on Google Versus\xa0AI (ChatGPT).},\n year = {2023}\n}\n'}","[{'authorId': '2197756168', 'name': 'Jeffrey R. Bellinger'}, {'authorId': '1934016602', 'name': 'Julian S. De La Chapa'}, {'authorId': '2233459156', 'name': 'Minhie W Kwak'}, {'authorId': '2233460577', 'name': 'Gabriel A Ramos'}, {'authorId': '95353991', 'name': 'D. Morrison'}, {'authorId': '5544564', 'name': 'B. Kesser'}]","OBJECTIVE
To quantitatively compare online patient education materials found using traditional search engines (Google) versus conversational Artificial Intelligence (AI) models (ChatGPT) for benign paroxysmal positional vertigo (BPPV).


STUDY DESIGN
The top 30 Google search results for ""benign paroxysmal positional vertigo"" were compared to the OpenAI conversational AI language model, ChatGPT, responses for 5 common patient questions posed about BPPV in February 2023. Metrics included readability, quality, understandability, and actionability.


SETTING
Online information.


METHODS
Validated online information metrics including Flesch-Kincaid Grade Level (FKGL), Flesch Reading Ease (FRE), DISCERN instrument score, and Patient Education Materials Assessment Tool for Printed Materials were analyzed and scored by reviewers.


RESULTS
Mean readability scores, FKGL and FRE, for the Google webpages were 10.7 ± 2.6 and 46.5 ± 14.3, respectively. ChatGPT responses had a higher FKGL score of 13.9 ± 2.5 (P < .001) and a lower FRE score of 34.9 ± 11.2 (P = .005), both corresponding to lower readability. The Google webpages had a DISCERN part 2 score of 25.4 ± 7.5 compared to the individual ChatGPT responses with a score of 17.5 ± 3.9 (P = .001), and the combined ChatGPT responses with a score of 25.0 ± 0.9 (P = .928). The average scores of the reviewers for all ChatGPT responses for accuracy were 4.19 ± 0.82 and 4.31 ± 0.67 for currency.


CONCLUSION
The results of this study suggest that the information on ChatGPT is more difficult to read, of lower quality, and more difficult to comprehend compared to information on Google searches."
570721f4b1f8c34af884caa919da7d2c384fde0c,"{'PubMedCentral': '10500068', 'DOI': '10.3389/fnagi.2023.1208661', 'CorpusId': 261457805, 'PubMed': '37719876'}","{'id': '31b2ea45-decb-4c4d-8e3e-683974781c91', 'name': 'Frontiers in Aging Neuroscience', 'type': 'journal', 'alternate_names': ['Front Aging Neurosci'], 'issn': '1663-4365', 'url': 'http://www.frontiersin.org/aging_neuroscience', 'alternate_urls': ['https://www.frontiersin.org/journals/aging-neuroscience', 'http://www.frontiersin.org/agingneuroscience/', 'http://journal.frontiersin.org/journal/aging-neuroscience']}","Associations between cognition, anxiety, depression, and residual dizziness in elderly people with BPPV",2023,47,20,"{'url': 'https://www.frontiersin.org/articles/10.3389/fnagi.2023.1208661/pdf', 'status': 'GOLD', 'license': 'CCBY', 'disclaimer': 'Notice: Paper or abstract available at https://pmc.ncbi.nlm.nih.gov/articles/PMC10500068, which is subject to the license by the author or copyright owner provided with this content. Please go to the source to verify the license and copyright information for your use.'}","{'name': 'Frontiers in Aging Neuroscience', 'volume': '15'}","{'bibtex': ""@Article{Sun2023AssociationsBC,\n author = {Jin'gan Sun and Xiaobao Ma and Yingshi Yang and Kuan He and Wei Wang and Jiali Shen and Lu Wang and Xiangping Chen and Yulian Jin and Jun Yang and Jianyong Chen},\n booktitle = {Frontiers in Aging Neuroscience},\n journal = {Frontiers in Aging Neuroscience},\n title = {Associations between cognition, anxiety, depression, and residual dizziness in elderly people with BPPV},\n volume = {15},\n year = {2023}\n}\n""}","[{'authorId': '13700418', 'name': ""Jin'gan Sun""}, {'authorId': '102021108', 'name': 'Xiaobao Ma'}, {'authorId': '11197603', 'name': 'Yingshi Yang'}, {'authorId': '2058350471', 'name': 'Kuan He'}, {'authorId': '2158630470', 'name': 'Wei Wang'}, {'authorId': '2115733880', 'name': 'Jiali Shen'}, {'authorId': '2153519649', 'name': 'Lu Wang'}, {'authorId': '1878466985', 'name': 'Xiangping Chen'}, {'authorId': '2217413470', 'name': 'Yulian Jin'}, {'authorId': '2146157196', 'name': 'Jun Yang'}, {'authorId': '2108298820', 'name': 'Jianyong Chen'}]","Objective To investigate the associations between cognition, anxiety, depression, and residual dizziness after successful repositioning maneuvers in the elderly with benign paroxysmal positional vertigo (BPPV). Methods We enrolled 40 elderly patients with BPPV in our outpatient department. We used the Dizziness Handicap Inventory (DHI), Visual Analog Scale (VAS), Patient Health Questionnaire-9 (PHQ-9), and Generalized Anxiety Disorder Questionnaire-7 (GAD-7) to assess the degree of dizziness, anxiety, and depression of participants before repositioning therapy, respectively. At the 1-week follow-up after BPPV treatment, each participant will be reassessed and divided into a group with residual dizziness (RD) and a group without residual dizziness (NRD) based on the follow-up DHI score. The Mini-Mental State Examination (MMSE) evaluated the cognitive function of the participants. Results The age, gender, duration of BPPV, and involved semicircular canals in the two groups did not show a significant difference. The RD group scored significantly higher on the DHI (p = 0.006), GAD-7 (p < 0.001), and PHQ-9 (p = 0.002) before the repositioning treatment than the NRD group. The two groups had no significant difference in MMSE score (p = 0.381). Anxiety and depression scores before repositioning treatment significantly and positively correlated with follow-up DHI scores (r = 0.678 and 0.522, respectively), but the MMSE score did not significantly relate to it. The univariate linear regression showed that the DHI (p < 0.001), GAD-7 (p < 0.001), and PHQ-9 (p = 0.002) scores before treatment could predict residual dizziness. The multivariate linear regression showed that GAD-7 before treatment was the only significant predictor of residual dizziness (p < 0.001). Conclusion The level of dizziness, anxiety, and depression before treatment can predict residual dizziness after successful repositioning maneuvers in the elderly with BPPV. Anxiety may be the strongest predictor of residual dizziness after successful repositioning treatment in elderly BPPV patients."
